{
  "schema_version": "1.0",
  "execution_id": "exe_0123456789abcdef0123456789abcdef",
  "tenant_id": "c601ce9c-0000-4000-8000-000000000001",
  "seq": 9,
  "type": "execution.handed_off",
  "at": "2026-08-04T09:00:14Z",
  "source": "runtime",
  "status": "completed",
  "data": {
    "child_execution_id": "exe_0123456789abcdef0123456789abcde2",
    "correlation_id": "cor_0123456789abcdef0123456789abcdef",
    "depth": 1,
    "target": {"graph_id": "mkbank-legal-main", "graph_version": "1.0.0"}
  }
}
