{
  "schema_version": "1.0",
  "execution_id": "exe_0123456789abcdef0123456789abcdef",
  "tenant_id": "c601ce9c-0000-4000-8000-000000000001",
  "seq": 8,
  "type": "execution.tool_completed",
  "at": "2026-08-04T09:00:12Z",
  "source": "derived",
  "status": "running",
  "data": {"tool_name": "current_time", "index": 0}
}
