{
  "schema_version": "1.0",
  "execution_id": "exe_0123456789abcdef0123456789abcdef",
  "tenant_id": "c601ce9c-0000-4000-8000-000000000001",
  "seq": 6,
  "type": "execution.waiting_for_approval",
  "at": "2026-08-04T09:00:07Z",
  "source": "runtime",
  "status": "waiting_for_approval",
  "data": {"interrupt_id": "int_7ab1"}
}
