{
  "schema_version": "1.0",
  "execution_id": "exe_4b7e2200000000000000000000000000",
  "tenant_id": "c601ce9c-0000-4000-8000-000000000001",
  "seq": 12,
  "type": "execution.completed",
  "at": "2026-08-04T09:00:12Z",
  "source": "runtime",
  "status": "completed",
  "data": {
    "operations": [
      {
        "operation_id": "op-2",
        "capability_id": "notification.send_sms",
        "status": "UNKNOWN",
        "resource_ref": "+998901234567",
        "verification_method": "READ_AFTER_WRITE",
        "terminal_reason": "CONNECTOR_ERROR"
      }
    ],
    "operations_coverage": {
      "complete": true
    }
  }
}
